### ISSUE TITLE
alpine 镜像频繁异常

### ISSUE THREAD

**Issue by gaoyifan** [ustclug/discussions#166]
来源：邮件<anjia0532@***>
```
直接从浏览器下载 http://mirrors.ustc.edu.cn/alpine/v3.6/main/x86_64/APKINDEX.tar.gz 是成功的，但是构建就总失败。



Step 4/6 : RUN sed -i 's/dl-cdn.alpinelinux.org/mirrors.ustc.edu.cn/g' /etc/apk/repositories && 	apk update && 	apk add tzdata && 	cp /usr/share/zoneinfo/Asia/Shanghai /etc/localtime && 	echo "Asia/Shanghai" >  /etc/timezone && 	rm -rf /var/cache/apk/*
 ---> Running in 5ddf55c328cd
fetch http://mirrors.ustc.edu.cn/alpine/v3.6/main/x86_64/APKINDEX.tar.gz
fetch http://mirrors.ustc.edu.cn/alpine/v3.6/community/x86_64/APKINDEX.tar.gz
ERROR: http://mirrors.ustc.edu.cn/alpine/v3.6/main: temporary error (try again later)
WARNING: Ignoring APKINDEX.ed4182b7.tar.gz: No such file or directory

ERROR: http://mirrors.ustc.edu.cn/alpine/v3.6/community: temporary error (try again later)
WARNING: Ignoring APKINDEX.ed65cd1b.tar.gz: No such file or directory

2 errors; 51 distinct packages available


频繁的时候一天会出现7,8次（需要不停的重新构建）
```

**Comment by gaoyifan** [comment]
问题可以复现，出现概率低于1%。原因调查中。

**Comment by anjia0532** [comment]
: ) ，目前国内alpine镜像还比较少。阿里的简直渣到不行。一直用中科大的alpine镜像，速度飞起，不过最近(大约1-2个月)每天都会有挺大概率会遇到，遇到后rebuild2-8次一般都能构建成功，但是无疑效率挺低的。希望能解决这个问题。

如果实在没办法，为了效率只能走自建镜像的不归路了[自建alpine镜像站](https://wiki.alpinelinux.org/wiki/How_to_setup_a_Alpine_Linux_mirror#Update_mirror_from_mqtt)

**Comment by gaoyifan** [comment]
@anjia0532  这个问题比较奇怪，对于错误请求，服务器端没有留下访问日志。只有alpine报错。在校内测试，平均一百多次出现一次故障。
我将持续跟进这个问题

**Comment by anjia0532** [comment]
在alpine官方github项目上也有不少讨论这个问题的，是alpine的问题？或者可以尝试bash定时curl地址看看？

或者是tcpdump抓一下alpine的包看看到底请求的是嘛

**Comment by gaoyifan** [comment]
我试过1秒curl一次，持续测试1天。然而每次取得的数据都是正确的。

**Comment by gaoyifan** [comment]
@anjia0532  请问这个问题大致是什么时间出现的？

**Comment by gaoyifan** [comment]
@anjia0532  尝试修复了这个问题，请再测试一下。

**Comment by anjia0532** [comment]
ok我将继续观察几天(2-7天)，会及时反馈的。非常感谢你的工作 : D

**Comment by anjia0532** [comment]
时间分布很碎，没啥具体规律。
就在刚刚，8:54构建失败了
```bash
Step 4/6 : RUN echo -e "https://mirrors.tuna.tsinghua.edu.cn/alpine/v3.6/main/\nhttps://mirrors.tuna.tsinghua.edu.cn/alpine/v3.6/community/" > /etc/apk/repositories && 	apk update && 	apk add tzdata && 	cp /usr/share/zoneinfo/Asia/Shanghai /etc/localtime && 	echo "Asia/Shanghai" >  /etc/timezone && 	rm -rf /var/cache/apk/*
 ---> Running in 711a370d05bd
fetch https://mirrors.tuna.tsinghua.edu.cn/alpine/v3.6/main/x86_64/APKINDEX.tar.gz
fetch https://mirrors.tuna.tsinghua.edu.cn/alpine/v3.6/community/x86_64/APKINDEX.tar.gz
v3.6.2-83-g1079181bed [https://mirrors.tuna.tsinghua.edu.cn/alpine/v3.6/main/]
v3.6.2-84-g6ee501e465 [https://mirrors.tuna.tsinghua.edu.cn/alpine/v3.6/community/]
OK: 8440 distinct packages available
(1/1) Installing tzdata (2017a-r0)
ERROR: tzdata-2017a-r0: temporary error (try again later)
```

**Comment by anjia0532** [comment]
你说，会不会是alpine内部的问题？理论上如果真实请求到你们的服务了，总会产生access_log的，哪怕是error_log,如果没有响应的日志，有可能是压根没请求到你们，如果没请求到你们就报错，不是alpine内部问题，就是网络问题
复现问题如果curl不行，可以尝试alpine镜像中cron+apk update && apk add 试一下



补充一下我这边的环境
host
```bash
cat /etc/lsb-release 
DISTRIB_ID=Ubuntu
DISTRIB_RELEASE=16.04
DISTRIB_CODENAME=xenial
DISTRIB_DESCRIPTION="Ubuntu 16.04.2 LTS"
```
gitlab+gitlabci+docker持续部署，在构建的时候出现的

**Comment by anjia0532** [comment]
@gaoyifan 高工，9:01重新构建的时候成功了

**Comment by anjia0532** [comment]
又失败了
9：03
```
Step 4/6 : RUN echo -e "https://mirrors.tuna.tsinghua.edu.cn/alpine/v3.6/main/\nhttps://mirrors.tuna.tsinghua.edu.cn/alpine/v3.6/community/" > /etc/apk/repositories && 	apk update && 	apk add tzdata && 	cp /usr/share/zoneinfo/Asia/Shanghai /etc/localtime && 	echo "Asia/Shanghai" >  /etc/timezone && 	rm -rf /var/cache/apk/*
 ---> Running in 29c5c08e1176
fetch https://mirrors.tuna.tsinghua.edu.cn/alpine/v3.6/main/x86_64/APKINDEX.tar.gz
ERROR: https://mirrors.tuna.tsinghua.edu.cn/alpine/v3.6/main/: temporary error (try again later)
WARNING: Ignoring APKINDEX.f0cbf920.tar.gz: No such file or directory

fetch https://mirrors.tuna.tsinghua.edu.cn/alpine/v3.6/community/x86_64/APKINDEX.tar.gz
v3.6.2-84-g6ee501e465 [https://mirrors.tuna.tsinghua.edu.cn/alpine/v3.6/community/]
1 errors; 2932 distinct packages available
```

**Comment by hosiet** [comment]
等一下我吐个槽，为啥现在日志显示的是 TUNA 而非 USTC

**Comment by anjia0532** [comment]
9:05 再次失败
担心是docker缓存镜像的问题导致的，所以再次构建之前执行了
`sudo docker system prune -f -a` 清空所有无用镜像
```
Step 4/6 : RUN echo -e "https://mirrors.tuna.tsinghua.edu.cn/alpine/v3.6/main/\nhttps://mirrors.tuna.tsinghua.edu.cn/alpine/v3.6/community/" > /etc/apk/repositories && 	apk update && 	apk add tzdata && 	cp /usr/share/zoneinfo/Asia/Shanghai /etc/localtime && 	echo "Asia/Shanghai" >  /etc/timezone && 	rm -rf /var/cache/apk/*
 ---> Running in 95db742cafaf
fetch https://mirrors.tuna.tsinghua.edu.cn/alpine/v3.6/main/x86_64/APKINDEX.tar.gz
fetch https://mirrors.tuna.tsinghua.edu.cn/alpine/v3.6/community/x86_64/APKINDEX.tar.gz
ERROR: https://mirrors.tuna.tsinghua.edu.cn/alpine/v3.6/main/: temporary error (try again later)
WARNING: Ignoring APKINDEX.f0cbf920.tar.gz: No such file or directory

v3.6.2-84-g6ee501e465 [https://mirrors.tuna.tsinghua.edu.cn/alpine/v3.6/community/]
1 errors; 2932 distinct packages available
```

**Comment by anjia0532** [comment]
@hosiet  我去？乌龙了？我先看看哈

**Comment by anjia0532** [comment]
我去。。。对不起对不起。。。讲真，我开始真用的中科大的。后来被替换成清华的。。。出问题找我后，我没仔细看，就给中科大的邮箱发邮件了。这乌龙闹的大了哈，高工说没访问记录。自刎已谢罪

**Comment by gaoyifan** [comment]
@anjia0532  先试一下吧。我在校内已经测不到错误了。

**Comment by anjia0532** [comment]
大哥，真对不起，除了第一次是中科大镜像导致的，后续我跟帖回复的带报错日志的都是清华的。。。。这乌龙闹的我都不好意思了。我会继续跟踪这个问题。2-7天，如果有异常我会及时补充，如果下周一都正常，我会及时反馈的。再次感谢你的工作。

**Comment by anjia0532** [comment]
9:49 

http://mirrors.ustc.edu.cn/alpine/v3.6/main/x86_64/APKINDEX.tar.gz

响应很慢，大约20s-30s

**Comment by anjia0532** [comment]
10：03
```
Step 1/6 : FROM openjdk:8-jdk-alpine
 ---> 478bf389b75b
Step 2/6 : ENV SPRING_OUTPUT_ANSI_ENABLED ALWAYS JHIPSTER_SLEEP 0 JAVA_OPTS ""
 ---> Using cache
 ---> 535205d754da
Step 3/6 : ADD *.war /app.war
 ---> d30a7f08fefd
Removing intermediate container 66e6cd5301a5
Step 4/6 : RUN echo -e "https://mirrors.ustc.edu.cn/alpine/latest-stable/main\nhttps://mirrors.ustc.edu.cn/alpine/latest-stable/community" > /etc/apk/repositories &&     apk update &&     apk add tzdata &&     cp /usr/share/zoneinfo/Asia/Shanghai /etc/localtime &&     echo "Asia/Shanghai" >  /etc/timezone &&     rm -rf /var/cache/apk/*
 ---> Running in bd5d1dfd3ff4
fetch https://mirrors.ustc.edu.cn/alpine/latest-stable/main/x86_64/APKINDEX.tar.gz
fetch https://mirrors.ustc.edu.cn/alpine/latest-stable/community/x86_64/APKINDEX.tar.gz
v3.6.2-83-g1079181bed [https://mirrors.ustc.edu.cn/alpine/latest-stable/main]
v3.6.2-84-g6ee501e465 [https://mirrors.ustc.edu.cn/alpine/latest-stable/community]
OK: 8440 distinct packages available
(1/1) Installing tzdata (2017a-r0)
ERROR: tzdata-2017a-r0: temporary error (try again later)

1 errors; 99 MiB in 51 packages
```

**Comment by gaoyifan** [comment]
@anjia0532 这应该是早上服务器压力比较大

**Comment by shankerwangmiao** [comment]
还是没看懂，到底是啥出错了？我们服务器上的日志也看了，没啥出错的地方啊。

**Comment by gaoyifan** [comment]
@shankerwangmiao  之前我发现alpine报“bad archive”，但nginx日志记录HTTP 200。
调试发现与 #163 有关联。修复后我在校内已经测不到问题了。
然而@anjia0532 的错误似乎是temporary error，我怀疑与用户的网络状况有关。这样一来无论访问的是USTC还是TUNA，都可能出错。

**Comment by anjia0532** [comment]
@gaoyifan 我这边的网络环境是联通100M带宽，docker 用了阿里镜像加速

```
sudo cat /etc/docker/daemon.json
{
  "registry-mirrors": ["https://xxxx.mirror.aliyuncs.com"]
}
```

**Comment by shankerwangmiao** [comment]
以及 alpine 是 http 下载的，乱序会有影响吗？

**Comment by gaoyifan** [comment]
@shankerwangmiao 按说是没有影响的。毕竟是内核在处理tcp。

**Comment by shankerwangmiao** [comment]
所以我觉得很是见鬼

**Comment by anjia0532** [comment]
偶尔还是有失败的情况，所以决定自建镜像了。我写的一篇文章 https://juejin.im/post/599b1b2a51882511264e7097

项目 https://github.com/anjia0532/alpine-package-mirror

请多指教

应该不算广告吧？哈哈

**Comment by gaoyifan** [comment]
@anjia0532  如果阿里、USTC、TUNA都报错，那么有极大的可能性是你本身网络的问题。

**Comment by anjia0532** [comment]
不是扎堆报错，阿里是网速慢，从浏览器打开就慢。清华遇到过好几种错误。相对来说，中科大的最为稳定。用了大约有半年了，就是最近1-2月？构建docker的时候安装软件报错几率越来越大了。这期间网络都正常没有过改动。先用自建镜像试试看吧，如果还报错，再排查是哪里的毛病吧

**Comment by anjia0532** [comment]
@gaoyifan 在内网环境下构建了镜像站，改成内网镜像，发现还是偶尔报错。怀疑是Dockerfile文件写法的问题导致的

```Dockerfile
# 这种写法会有很大几率报错(20次有1-3次失败)
RUN echo -e "http://alpine.xxx.com/latest-stable/main\nhttp://alpine.xxx.com/latest-stable/community" > /etc/apk/repositories &&\
    apk update &&\
    apk --no-cache add tzdata && \
    cp /usr/share/zoneinfo/Asia/Shanghai /etc/localtime && \
    echo "Asia/Shanghai" >  /etc/timezone && \
    rm -rf /var/cache/apk/*


# RUN 命令分开写后，没再包过错，原因不明。
RUN echo -e "http://alpine.xxx.com/latest-stable/main\nhttp://alpine.xxx.com/latest-stable/community" > /etc/apk/repositories
RUN apk update
RUN apk --no-cache add tzdata && \
    cp /usr/share/zoneinfo/Asia/Shanghai /etc/localtime && \
    echo "Asia/Shanghai" >  /etc/timezone && \
    rm -rf /var/cache/apk/*
```

**Comment by StephenPCG** [comment]
@anjia0532 我认为跟RUN命令的写法没有关系，你的现象只是一个巧合。我觉得问题可能出在你的docker主机环境，或者dns上面。不清楚你使用的什么dns，如果是自建的dns（比如dnsmasq）的话，不妨看看dns日志中是否有解析错误的情况。

由于无论内部自建镜像还是第三方的镜像都会出问题，说明问题不应该在镜像上，请求很可能没有发送到镜像上。因此，应该是网络问题，导致请求达到不了镜像的原因，最有可能的是：
* DNS请求失败
* 运行Docker的主机网络配置有问题，存在随机（或按某规则）拒绝转发包的情况
* 可能你的Docker到镜像站之间的网络中的某一处（一般来说是你的主机或者路由器）存在上述行为

当然还有可能有其他情形，你可以按这个思路去排查。

**Comment by gaoyifan** [comment]
@StephenPCG  （虽然不是很确定）前段时间在校内测试时，如果写成下面的指令，从来没有出过错；但执行 @anjia0532 的RUN指令，就有概率出错。
```
RUN apk update
RUN apk add tzdata
```
由于使用官方源时，无论哪种写法都不报错，所以我当时也以为是巧合，就没有在意。没想到竟然惊人得相似。

**Comment by gaoyifan** [comment]
这两种写法最大的差异就是：如果拆成两条RUN指令，指令之间会有一定间隔时间；如果用`&&`的方式，就没这种间隔了。

**Comment by anjia0532** [comment]
@StephenPCG 感谢回复。如果命令合并(为了减小docker体积)就会有较小概率的失败(20-30次构建能发生1-2次)，两台机器(构建主机和alpine-mirror主机)在一个局域网里。如果抛开构建时的失败，在运行镜像时，`attach`或者`exec`执行相同的合并命令，尝试了20余次，均正常。

一旦拆分开多条后，目前大约构建了30次左右，均成功。

```
cat /etc/lsb-release 
DISTRIB_ID=Ubuntu
DISTRIB_RELEASE=16.04
DISTRIB_CODENAME=xenial
DISTRIB_DESCRIPTION="Ubuntu 16.04.2 LTS"
```

```
docker info
Containers: 2
 Running: 2
 Paused: 0
 Stopped: 0
Images: 2
Server Version: 17.05.0-ce
Storage Driver: aufs
 Root Dir: /var/lib/docker/aufs
 Backing Filesystem: extfs
 Dirs: 28
 Dirperm1 Supported: true
Logging Driver: json-file
Cgroup Driver: cgroupfs
Plugins: 
 Volume: local
 Network: bridge host macvlan null overlay
Swarm: inactive
Runtimes: runc
Default Runtime: runc
Init Binary: docker-init
containerd version: 9048e5e50717ea4497b757314bad98ea3763c145
runc version: 9c2d8d184e5da67c95d601382adf14862e4f2228
init version: 949e6fa
Security Options:
 apparmor
 seccomp
  Profile: default
Kernel Version: 4.8.0-49-generic
Operating System: Ubuntu 16.04.2 LTS
OSType: linux
Architecture: x86_64
CPUs: 4
Total Memory: 7.717GiB
Name: sn-pc
ID: SJFS:IBU4:5TIQ:37BS:ZZFQ:NIM7:OJSL:AD6W:UHXQ:4NA6:SK4P:4QCQ
Docker Root Dir: /var/lib/docker
Debug Mode (client): false
Debug Mode (server): false
Registry: https://index.docker.io/v1/
Experimental: false
Insecure Registries:
 127.0.0.0/8
Registry Mirrors:
 https://prajua6n.mirror.aliyuncs.com/
Live Restore Enabled: false

WARNING: No swap limit support
```

@gaoyifan 如果像你所说的，拆分后会有一定间隔时间(类似修改源地址未生效)，那么他也不应该fatch 设置的源地址啊(e.g. 中科大镜像地址)，未生效的话应该是默认的dl-cdn地址。

我再观察观察看看吧，如果后期有啥异动再说。

目前暂时用自建镜像。

**Comment by anjia0532** [comment]
@gaoyifan 抱歉又因为这个事情打扰你，好像在alpine同步的时候(因为网络原因同步时间较长)，更容易失败。

**Comment by gaoyifan** [comment]
@anjia0532  能否提供一下同步时间和同步日志。

**Comment by anjia0532** [comment]
我在我自己搭建的镜像上，故意限速，导致同步一次大约5-10分钟，在此期间构建镜像，失败的几率会更大一些。我现在改成1月同步一次了(因为对于软件更新要求不太高)。

现在的主要问题是，建的时候偷懒，没开nginx日志，无法回放当时的网络请求。

1. 到底有没有请求到镜像的 APKINDEX.tar.gz 

2. 下载下APKINDEX.tar.gz后，安装的时候，有没有请求到镜像服务(try again later)

不好轻易下结论。

附 alpine同步日志
```bash
/ # /etc/periodic/monthly/package-rsync
receiving file list ... done

sent 187 bytes  received 355,604 bytes  16,548.42 bytes/sec
total size is 11,691,774,398  speedup is 32,861.36
```

**Comment by gaoyifan** [comment]
@anjia0532 从rsync日志来看，同步是正常的。如果本地镜像也有问题，建议将这个问题反馈给alpine官方。

**Comment by anjia0532** [comment]
@gaoyifan 恩，好的。这件事得到了你们很多帮助。非常感谢 : )

**Comment by anjia0532** [comment]
@gaoyifan 经过研究，已经找到问题的根源了。根据 @StephenPCG 说的第一条
> DNS请求失败
进行排查，发现果然是这样。

```bash
tcpdump -i docker0

10:47:43.038404 IP6 :: > ff02::16: HBH ICMP6, multicast listener report v2, 1 group record(s), length 28
10:47:43.114734 ARP, Request who-has 172.17.0.1 tell 172.17.0.2, length 28
10:47:43.114746 ARP, Reply 172.17.0.1 is-at 02:42:30:19:53:45 (oui Unknown), length 28
10:47:43.114750 IP 172.17.0.2.48223 > google-public-dns-a.google.com.domain: 18503+ A? alpine.xxx.com. (39)
10:47:43.114775 IP 172.17.0.2.48223 > google-public-dns-b.google.com.domain: 18503+ A? alpine.xxx.com. (39)
10:47:43.114827 IP 172.17.0.2.48223 > google-public-dns-a.google.com.domain: 18687+ AAAA? alpine.xxx.com. (39)
10:47:43.114833 IP 172.17.0.2.48223 > google-public-dns-b.google.com.domain: 18687+ AAAA? alpine.xxx.com. (39)
10:47:43.209679 IP google-public-dns-a.google.com.domain > 172.17.0.2.48223: 18503 1/0/0 A 172.60.20.6 (55)
10:47:43.229261 IP google-public-dns-a.google.com.domain > 172.17.0.2.48223: 18687 0/1/0 (106)

```

走的是`google-public-dns-a.google.com`dns，但是因为一些不可描述的原因，google在国内是瘫痪的，所以会偶尔抽风，所以，即使是自建镜像，或者用中科大，阿里，清华镜像，都不可避免的会出现异常。

修改宿主机 hosts文件后，就正常了

所以要善用工具(e.g. tcpdump就不用绕这么多弯了)

**Comment by shishaoqi** [comment]
最近使用 docker-compose 拉取 php镜像又出现了，最终找到这个：

Use one of the mirrors:
`http://dl-cdn.alpinelinux.org/alpine/
http://nl.alpinelinux.org/alpine/
http://dl-2.alpinelinux.org/alpine/
http://dl-3.alpinelinux.org/alpine/
http://dl-4.alpinelinux.org/alpine/
http://dl-5.alpinelinux.org/alpine/
http://dl-6.alpinelinux.org/alpine/
http://dl-8.alpinelinux.org/alpine/
http://distrib-coffee.ipsl.jussieu.fr/pub/linux/alpine/alpine/
http://mirror.yandex.ru/mirrors/alpine/
http://mirrors.gigenet.com/alpinelinux/
http://repos.lax-noc.com/alpine/
http://repos.dfw.lax-noc.com/alpine/
http://repos.mia.lax-noc.com/alpine/
http://mirror1.hs-esslingen.de/pub/Mirrors/alpine/
http://liskamm.alpinelinux.uk/
http://mirrors.2f30.org/alpine/
http://mirror.leaseweb.com/alpine/
http://repository.fit.cvut.cz/mirrors/alpine/
http://alpine.mirror.far.fi/
http://lasca.ic.unicamp.br/pub/alpine/
http://alpinelinux.c3sl.ufpr.br/`

https://github.com/gliderlabs/docker-alpine/issues/279
加fanqiang后，能正常拉取到。希望这么多地址里，可以找到正常拉取的
